{
  "$schema": "https://json-schema.org/draft/2020-12/schema",
  "type": "object",
  "additionalProperties": false,
  "properties": {
    "incident_id": {"type": "string"},
    "summary": {"type": "string"},
    "root_cause": {"type": "string"},
    "confidence": {"type": "number", "minimum": 0, "maximum": 1},
    "evidence": {"type": "array", "items": {"type": "string"}},
    "proposed_action": {"type": "string", "enum": ["none", "fix", "escalate"]},
    "changed_files": {"type": "array", "items": {"type": "string"}},
    "verification": {"type": "array", "items": {"type": "string"}},
    "escalation_required": {"type": "boolean"},
    "final_line": {"type": "string"}
  },
  "required": [
    "incident_id",
    "summary",
    "root_cause",
    "confidence",
    "evidence",
    "proposed_action",
    "changed_files",
    "verification",
    "escalation_required",
    "final_line"
  ]
}
