{"incident_id":"INC-20260927T115335472557Z","summary":"The alert is an explicit test notification, not a production incident. No changes were made.","root_cause":"Synthetic ResponderTest notification with test=true; no actual failing express-order lookup is evidenced.","confidence":0.99,"evidence":["alert.json identifies alertname=ResponderTest and test=true.","alert.json summary states: Test notification; no incident to fix.","logs.json, metrics.json, and traces.json contain no telemetry results because their local endpoints were unavailable.","Recent commits and the current read-only diff were inspected; no incident-specific change was warranted."],"proposed_action":"none","changed_files":[],"verification":["Confirmed the evidence packet explicitly marks the alert as a test notification.","Confirmed no files were modified during this investigation.","Tests were not run because this was explicitly a test notification requiring no remediation."],"escalation_required":false,"final_line":"INC-20260927T115335472557Z was a test notification, so no fix was required."}